{
  "schema_version": 1,
  "generated": "2026-09-05T22:30:00Z",
  "release": "packs-v0",
  "packs": [
    {
      "id": "scary-optimus",
      "kind": "character",
      "name": "Scary Optimus",
      "version": "1.0.0",
      "url": "https://github.com/wrc2tuning/Link-Box.Ai-Desk-Agent-Packs/releases/download/packs-v0/character-scary-optimus-1.0.0.zip",
      "sha256": "f2296760441effe50711e2353d537f20b8d4b3357edfb6f9d35270740d529b48",
      "bytes": 81674284,
      "preview": "https://raw.githubusercontent.com/wrc2tuning/Link-Box.Ai-Desk-Agent-Packs/main/characters/scary-optimus/preview.png",
      "license": "LicenseRef-Owner",
      "requires": {
        "overlay_schema": 1
      }
    },
    {
      "id": "stylized-boy",
      "kind": "character",
      "name": "Stylized Boy",
      "version": "1.0.0",
      "url": "https://github.com/wrc2tuning/Link-Box.Ai-Desk-Agent-Packs/releases/download/packs-v0/character-stylized-boy-1.0.0.zip",
      "sha256": "3a8503bddd67f38808115a898a33dea8c41f1912a3127819896d82fe2f01c339",
      "bytes": 31779769,
      "preview": "https://raw.githubusercontent.com/wrc2tuning/Link-Box.Ai-Desk-Agent-Packs/main/characters/stylized-boy/preview.png",
      "license": "LicenseRef-Owner",
      "requires": {
        "overlay_schema": 1
      }
    }
  ]
}
